{
  "assigned_to": "agt-worker-dfb8a4cda6f7",
  "depends_on": [],
  "project_id": "ff6a9f90-1e0c-5fe7-8a9f-9b354c1aa754",
  "repomesh": {
    "attempt_id": "ca0ef2b0-a6c7-4d03-a0e3-b7bf13aef13a",
    "base_sha": "882231dd887688a986b0faec656a90d29141406c",
    "budget_seconds": 2700,
    "generation": 1,
    "kind": "construction",
    "organization_id": "7ce7e70e-f501-5ece-b998-ce2f4c4cd550",
    "package": "base/package.json",
    "repository_id": "dfb8a4cd-a6f7-4ee7-95e4-197963151308",
    "task_id": "b6e0bc59-255a-4edc-a186-47f5eeb3050c"
  },
  "room_id": "!3IU075BSWiAQORHR4e:matrix-local.agentteams.io:18080",
  "status": "assigned",
  "task_id": "ca0ef2b0-a6c7-4d03-a0e3-b7bf13aef13a",
  "task_title": "Implement multi-currency quote() for repomesh-e2e-pricing-core (attempt 1)"
}
